{
  "schema_version": "1.0",
  "target_id": "testnet-usdc-gb4mm",
  "tenant_id": "tenant-testnet-sample",
  "network": "stellar:testnet",
  "asset_code": "USDC",
  "asset_issuer": "GBBD47IF6LWK7P7MDEVSCWR7DPUWV3NY3DTQEVFL4NAT4AQH3ZLLFLA5",
  "account": "GB4MMSZ5FY3KOCMMN77DNJBSKXFZVRXMLM5SKKDIVGTWGR55DKJM7GSD",
  "unit": "USDC",
  "instrument_id": "testnet:asset:USDC:GBBD47IF6LWK7P7MDEVSCWR7DPUWV3NY3DTQEVFL4NAT4AQH3ZLLFLA5",
  "representation_id": "rep-testnet-classic-USDC-GBBD47IF6LWK7P7MDEVSCWR7DPUWV3NY3DTQEVFL4NAT4AQH3ZLLFLA5",
  "source_id": "stellar-testnet",
  "expected_sac_contract_id": "CBIELTK6YBZJU5UP2WWQEUCYKLPU6AUNZ2BQ4WWFEIE3USCIHMXQDAMA",
  "synthetic": false,
  "description": "Real Stellar testnet USDC (issuer GBBD47IF6LWK7P7MDEVSCWR7DPUWV3NY3DTQEVFL4NAT4AQH3ZLLFLA5) observed for account GB4MMSZ5 (path payments through the issuer). Third-party public testnet data, unrelated to the synthetic DEMO-A subscription."
}
