{
  "schema_version": "1.0",
  "target_id": "synthetic-synusd-clawback-holder-a",
  "tenant_id": "tenant-synthetic-stellar",
  "network": "stellar:testnet",
  "asset_code": "SYNUSD",
  "asset_issuer": "GAEUGPNN6CYA2ZVMXQOF2DGALOKTJRLHKVAT2JLJTTY3MNSWMC7GRZDR",
  "account": "GBQ3WUJWQAW3763ICLII7BSND6SG66CW3G7D6RG5LG5HFXJQI7ZSXQCM",
  "unit": "SYNUSD",
  "instrument_id": "synthetic:asset:SYNUSD:GAEUGPNN6CYA2ZVMXQOF2DGALOKTJRLHKVAT2JLJTTY3MNSWMC7GRZDR",
  "representation_id": "rep-synthetic-classic-SYNUSD-GAEUGPNN6CYA2ZVMXQOF2DGALOKTJRLHKVAT2JLJTTY3MNSWMC7GRZDR",
  "source_id": "stellar-synthetic",
  "expected_sac_contract_id": "CC4WLUOJJBODMOPTLFJRN77LAAILXXHCQB4RUVY32LYHXO7VT4TG57IJ",
  "synthetic": true,
  "description": "SYNTHETIC clawback cases (build_clawbacks.py). The accounts, transactions and assets do not exist on any network."
}
